{
  "$schema": "https://json-schema.org/draft/2020-12/schema",
  "title": "Desktop implementation phase result",
  "type": "object",
  "additionalProperties": false,
  "required": [
    "schema_version",
    "phase_id",
    "status",
    "started_at",
    "ended_at",
    "task_ids",
    "summary",
    "checks",
    "artifacts",
    "known_limits"
  ],
  "properties": {
    "schema_version": {
      "type": "string",
      "const": "1.0"
    },
    "phase_id": {
      "type": "string",
      "pattern": "^P(?:10|[0-9])$"
    },
    "status": {
      "enum": [
        "complete",
        "blocked",
        "failed",
        "partial"
      ]
    },
    "started_at": {
      "type": "string",
      "pattern": "^\\d{4}-\\d{2}-\\d{2}T\\d{2}:\\d{2}:\\d{2}(?:\\.\\d+)?Z$"
    },
    "ended_at": {
      "type": "string",
      "pattern": "^\\d{4}-\\d{2}-\\d{2}T\\d{2}:\\d{2}:\\d{2}(?:\\.\\d+)?Z$"
    },
    "task_ids": {
      "type": "array",
      "items": {
        "type": "string",
        "pattern": "^P(?:10|[0-9])-\\d{2}$"
      },
      "minItems": 1,
      "uniqueItems": true
    },
    "summary": {
      "type": "string",
      "minLength": 1,
      "maxLength": 5000
    },
    "checks": {
      "type": "array",
      "items": {
        "type": "object",
        "additionalProperties": false,
        "required": [
          "name",
          "status",
          "command_or_method"
        ],
        "properties": {
          "name": {
            "type": "string",
            "minLength": 1
          },
          "status": {
            "enum": [
              "pass",
              "warning",
              "fail",
              "not_run"
            ]
          },
          "command_or_method": {
            "type": "string",
            "minLength": 1
          },
          "evidence": {
            "type": "array",
            "items": {
              "type": "string"
            }
          }
        }
      }
    },
    "artifacts": {
      "type": "array",
      "items": {
        "type": "string"
      }
    },
    "native_test": {
      "type": "object",
      "additionalProperties": false,
      "properties": {
        "launched": {
          "type": "boolean"
        },
        "playwright": {
          "type": "boolean"
        },
        "computer_use": {
          "type": "boolean"
        },
        "screenshot_paths": {
          "type": "array",
          "items": {
            "type": "string"
          }
        },
        "recording_paths": {
          "type": "array",
          "items": {
            "type": "string"
          }
        }
      }
    },
    "known_limits": {
      "type": "array",
      "items": {
        "type": "string"
      }
    },
    "spec_sync": {
      "type": "object",
      "additionalProperties": false,
      "required": ["changed", "unchanged"],
      "properties": {
        "changed": { "type": "array", "minItems": 1, "items": { "type": "string", "minLength": 1 } },
        "unchanged": { "type": "array", "items": { "type": "string", "minLength": 1 } }
      }
    },
    "code_revision": {
      "type": [
        "string",
        "null"
      ]
    }
  }
}
